{"dataset":{"dataset_id":"readme-showcase-retrieval","dataset_revision":2,"manifest_sha256":"45aa6396def1954f52b8d12c96627039664fac39ab5ec24ac2858c6dbdde7486"},"mode":"production","query":{"evidence_sha256":"aaaaaaaaaaaaaaaaaaaaaaaaaaaaaaaaaaaaaaaaaaaaaaaaaaaaaaaaaaaaaaaa","manifest_features":["generated interface","local server"],"project_type":"web-framework","sections":["overview","quick-start"],"tags":["api","observable-output"]},"reason":null,"records":[{"pattern":{"proof":"Tie capability claims to local server output and generated interface behavior visible after first run.","structure":"Value statement, installation, minimal file, run command, expected local endpoints, then feature links.","summary":"Lead with framework value, follow with a tiny complete application, then show observable generated behavior."},"project_types":["web-framework"],"reasons":[{"code":"retrieval.project-type","matched_values":["web-framework"],"signal":"project_type_basis_points"},{"code":"retrieval.section-intent","matched_values":["overview","quick-start"],"signal":"section_overlap_basis_points"},{"code":"retrieval.tag","matched_values":["api","observable-output"],"signal":"tag_overlap_basis_points"},{"code":"retrieval.manifest-feature","matched_values":["generated","interface","local","server"],"signal":"manifest_feature_overlap_basis_points"},{"code":"retrieval.bm25","matched_values":["api","framework","generated","interface","local","observable","output","overview","quick","server","start","web"],"signal":"bm25_basis_points"}],"record_id":"fastapi-proof-first-overview","score_basis_points":7000,"section_intents":["overview","quick-start"],"signals":{"bm25_basis_points":10000,"diversity_penalty_basis_points":0,"manifest_feature_overlap_basis_points":10000,"project_type_basis_points":10000,"section_overlap_basis_points":10000,"tag_overlap_basis_points":10000},"source":{"commit":"95f8322ee1dcda7ceace7b1c4f6c9915b36d748f","human_reviewed":true,"license_evidence_sha256":"4ec89ffc81485b97fec584b2d4a961032eeffe834453894fd9c1274906cc744e","license_evidence_spdx":"MIT","license_evidence_url":"https://github.com/fastapi/fastapi/blob/95f8322ee1dcda7ceace7b1c4f6c9915b36d748f/LICENSE","license_spdx":"MIT","material_sha256":"b765d1bb8a76106a5bff83fdae798a12150b03ef9cc99f37d68d1e5d8dc2938a","repository_url":"https://github.com/fastapi/fastapi"},"source_split":"train","tags":["api","developer-experience","observable-output"]}],"schema_version":2,"status":"available"}
